Consultas principales,Clics,Impresiones,CTR,Posición
blanca real,586,1123,52.18%,1.21
blancareal,348,707,49.22%,1.14
obra nueva fuengirola,195,3966,4.92%,4.67
blanca real estate,144,400,36%,5
obra nueva en fuengirola,100,1429,7%,4.07
obra nueva mijas,53,2257,2.35%,6.02
condesa hills,53,117,45.3%,1.11
obra nueva benalmadena,37,1174,3.15%,8.21
blanca hills,32,223,14.35%,2.22
obra nueva miramar fuengirola,27,215,12.56%,4.17
calahonda sunset,26,1504,1.73%,6.63
almitak mijas,26,298,8.72%,3.02
almitak,20,1137,1.76%,5.66
obra nueva mijas costa,19,1169,1.63%,5.65
pisos obra nueva fuengirola,19,342,5.56%,5.06
pisos nuevos en fuengirola,15,323,4.64%,4.61
fuengirola obra nueva,13,221,5.88%,4.47
nylva homes,12,1231,0.97%,6.97
"obra nueva las lagunas, mijas",12,545,2.2%,9.48
proximas construcciones en fuengirola,12,186,6.45%,5.3
obra nueva fuengirola centro,12,157,7.64%,3.58
obra nueva las lagunas mijas,11,846,1.3%,9.49
obra nueva en benalmadena,10,578,1.73%,8.83
obra nueva benalmádena,10,386,2.59%,8.24
pisos nuevos fuengirola,10,102,9.8%,4.89
obra nueva mijas las lagunas,8,153,5.23%,6.59
orion collection,8,98,8.16%,4.36
obra nueva fuengirola mijas,8,59,13.56%,3.24
appartement costa del sol kopen,7,776,0.9%,10.45
obra nueva en mijas,7,530,1.32%,8.27
obra nueva en mijas costa,7,208,3.37%,8.12
"obra nueva los boliches, fuengirola",7,187,3.74%,6.48
nueva construccion fuengirola,7,110,6.36%,3.85
white hills villas,7,71,9.86%,3.1
piso en fuengirola,5,2319,0.22%,10.44
maison a vendre fuengirola,5,399,1.25%,13.94
villas fuengirola,5,372,1.34%,18.26
comprare casa in spagna tasse,5,216,2.31%,9.24
torreblanca hills,5,62,8.06%,1.58
appartement te koop costa del sol,4,1604,0.25%,9.56
laguna suites fuengirola,4,257,1.56%,9.58
pisos de obra nueva en fuengirola,4,51,7.84%,3.9
pisos obra nueva benalmadena,4,29,13.79%,8.14
nieuwbouw estepona,3,961,0.31%,22.65
quien paga los honorarios de la inmobiliaria en una venta,3,793,0.38%,36.36
appartementen te koop costa del sol,3,475,0.63%,8.75
villas torreblanca,3,215,1.4%,34.34
frais d'agence immobilière en espagne,3,138,2.17%,19.9
estate agent fees in spain,3,115,2.61%,11.43
appartement kopen costa del sol,2,3228,0.06%,12.37
pisos en estepona,2,3041,0.07%,17.05
villas en fuengirola,2,1207,0.17%,10.63
piso en estepona,2,767,0.26%,11.85
costa del sol appartement kopen,2,552,0.36%,11.14
casas adosadas en mijas,2,311,0.64%,9.08
estate agent fees spain,2,219,0.91%,16.2
obra nueva manilva,2,171,1.17%,21.29
appartement te koop calahonda,2,127,1.57%,10.05
obra nueva,2,92,2.17%,5.89
edificio magina mijas,2,67,2.99%,7.07
quien paga la comision de venta de un inmueble,2,65,3.08%,4.68
costa del sol te koop,2,65,3.08%,14.22
centro comercial miraflores,2,56,3.57%,12.64
maison fuengirola,2,27,7.41%,8.3
venta villas marbella,2,18,11.11%,25.67
what commission do estate agents get,2,17,11.76%,5.47
luxury villas fuengirola,2,5,40%,6.8
appartement costa del sol,1,997,0.1%,36.75
villa fuengirola,1,791,0.13%,23.17
palo alto marbella,1,737,0.14%,33.14
appartement te koop costa del sol zeezicht,1,695,0.14%,32.13
piso fuengirola,1,425,0.24%,15.79
comision agente inmobiliario españa,1,412,0.24%,21.13
alquiler vacacional mijas costa,1,350,0.29%,34.76
palo alto ojen,1,337,0.3%,17.69
villa en venta marbella,1,325,0.31%,75.09
exclusive homes fuengirola,1,312,0.32%,26.38
fuengirola hills,1,290,0.34%,5.61
calahonda appartement te koop,1,252,0.4%,10.45
real estate agency costa del sol,1,220,0.45%,48.04
dorronsoro arquitectos,1,218,0.46%,3.06
penthouse for sale estepona,1,214,0.47%,28.85
appartement te koop mijas costa,1,199,0.5%,13.54
fuengirola villa,1,184,0.54%,24.94
neubau costa del sol,1,165,0.61%,6.88
villas en venta fuengirola,1,163,0.61%,3.52
quien paga la inmobiliaria en una venta,1,141,0.71%,15.52
quién paga a la inmobiliaria el comprador o el vendedor,1,138,0.72%,5.14
venta de villas en fuengirola,1,130,0.77%,3.62
te koop costa del sol,1,130,0.77%,8.15
appartement a vendre fuengirola,1,126,0.79%,26.56
pisos cancelada,1,125,0.8%,13.77
new build apartments fuengirola,1,122,0.82%,5.25
appartementen costa del sol,1,121,0.83%,15.37
immobilier,1,114,0.88%,9.73
quien paga el iva de la comisión inmobiliaria,1,108,0.93%,9.12
laguna suites mijas,1,106,0.94%,11.08
obra nueva en estepona,1,102,0.98%,32.84
obra nueva estepona centro,1,101,0.99%,13.51
quien paga honorarios inmobiliaria compra,1,87,1.15%,6.38
appartementen costa del sol te koop,1,77,1.3%,6.94
estate agents fees in spain,1,76,1.32%,27.99
cuando cobra la inmobiliaria sus honorarios,1,58,1.72%,21.74
estate agents fees spain,1,57,1.75%,27.25
quien paga comision inmobiliaria,1,55,1.82%,25.38
obra nueva benalmádena costa,1,54,1.85%,8.3
obra nueva en benalmádena,1,51,1.96%,6.84
laguna suites,1,50,2%,12.42
quien paga las comisiones de la inmobiliaria,1,50,2%,17.24
casa adosada mijas,1,48,2.08%,6.12
blanca inmobiliaria,1,39,2.56%,21.23
real estate calahonda,1,38,2.63%,20.39
quien paga a la inmobiliaria en una compraventa,1,36,2.78%,30.33
costa del sol appartement te koop,1,32,3.12%,8.69
casas adosadas mijas costa baratas,1,32,3.12%,10.47
villa palo alto marbella,1,32,3.12%,11.12
venta fuengirola,1,31,3.23%,14.1
obra nueva en fuengirola centro,1,28,3.57%,6.79
nuove costruzioni costa del sol,1,26,3.85%,2.12
calle jilguero torreblanca,1,25,4%,7.72
calle jilguero fuengirola,1,25,4%,18.2
does the buyer pay estate agent fees,1,24,4.17%,3.67
marcelo navarro,1,24,4.17%,15.08
agevolazioni prima casa in spagna,1,23,4.35%,36.52
piso obra nueva fuengirola,1,22,4.55%,4.73
condesa,1,22,4.55%,10.27
casa blanca real estate,1,22,4.55%,34.27
balcones del pinillo,1,21,4.76%,3.19
villas en venta en fuengirola,1,20,5%,5.25
las terrazas miraflores,1,20,5%,5.45
centro comercial las terrazas miraflores,1,18,5.56%,3.44
piso en cancelada,1,18,5.56%,9.61
quien paga a la agencia inmobiliaria en una venta,1,16,6.25%,2.06
miraflores centro comercial,1,15,6.67%,10.07
real blanca,1,14,7.14%,4.43
centro comercial las terrazas mijas,1,13,7.69%,6.23
sunset calahonda,1,12,8.33%,8.58
villa torreblanca fuengirola,1,11,9.09%,14.36
promociones obra nueva mijas costa,1,10,10%,7.4
blanco real estate,1,10,10%,15.2
pisos nueva construccion fuengirola,1,8,12.5%,3.38
case in vendita a marbella sul mare,1,8,12.5%,14.5
las inmobiliarias cobran al comprador,1,8,12.5%,32.38
maison style espagnol moderne,1,7,14.29%,11.43
appartement fuengirola à vendre,1,7,14.29%,24.57
obras nuevas en fuengirola,1,6,16.67%,4.5
whitehills,1,5,20%,2.8
viviendas de nueva construcción,1,4,25%,4.5
what commission do estate agents charge in spain,1,4,25%,5.25
comercializadora inmobiliaria,1,4,25%,6
los pacos fuengirola,1,4,25%,22
new developments in costa del sol,1,4,25%,31.25
pisos de obra nueva,1,3,33.33%,2
piso en venta obra nueva,1,3,33.33%,6.67
real estate agency,1,3,33.33%,8
pago inmobiliaria,1,3,33.33%,32
villa dione,1,2,50%,2.5
piso nuevo,1,2,50%,3.5
how much commission do estate agents charge in spain,1,2,50%,8
urbanizacion fuengirola,1,2,50%,21.5
new development estepona,1,2,50%,46
biancareal,1,1,100%,1
real state marbella,1,1,100%,1
seller pays,1,1,100%,1
work agencies near me,1,1,100%,1
blanca propiedades,1,1,100%,2
pisos nueva construcción,1,1,100%,2
que es una inmobiliaria y como funciona,1,1,100%,3
real estate near me,1,1,100%,3
la inmobiliaria me ha engañado,1,1,100%,4
tourist rentals,1,1,100%,7
case di nuova costruzione,1,1,100%,12
it isnt there,1,1,100%,20
pisos en fuengirola,0,2358,0%,13.27
penthouses for sale estepona,0,1164,0%,33.6
piso en marbella,0,1100,0%,13.55
agence immobilière malaga,0,1027,0%,23.97
agence immobilière espagne,0,1006,0%,51.05
plot for sale in nueva andalucia,0,921,0%,55.05
agence immobiliere malaga,0,830,0%,19.75
villa torreblanca,0,745,0%,52.89
cocina urbano torrox costa,0,732,0%,8.47
nieuwbouw villa fuengirola,0,725,0%,6.21
pisos obra nueva estepona,0,718,0%,20.88
agence immobilière française en espagne,0,655,0%,48.15
torreblanca villas,0,638,0%,28.74
sea view apartments for sale costa del sol,0,565,0%,20.38
comprar en fuengirola,0,564,0%,18.89
pisos estepona,0,534,0%,14.28
spagna case,0,530,0%,28.29
immobilier costa del sol,0,508,0%,49.57
nieuwbouw fuengirola,0,506,0%,28.49
agence immobilière costa brava,0,505,0%,57.37
nieuwbouw villa costa del sol,0,496,0%,14.18
case in spagna,0,495,0%,42.74
apartments for sale fuengirola costa del sol,0,493,0%,30.49
fuengirola villas,0,486,0%,15.64
manilva villas,0,483,0%,36.49
villa kopen fuengirola,0,476,0%,30.07
penthouse costa del sol,0,469,0%,25.09
calahonda villas,0,455,0%,73.94
agence immobilière costa blanca,0,449,0%,55.59
huurlicentie andalusie,0,447,0%,86.37
immobilier malaga,0,430,0%,41.23
promociones obra nueva costa del sol,0,428,0%,41.02
apartments estepona costa del sol,0,415,0%,59.88
penthouse estepona,0,413,0%,53.6
rental license andalusia,0,401,0%,85.76
nieuwbouw costa del sol,0,398,0%,20.54
luxe nieuwbouw villa,0,398,0%,29.36
inmobiliaria en puerto de la torre,0,398,0%,43.86
new apartments costa del sol,0,395,0%,65.84
case spagna,0,389,0%,43.16
comision agencia inmobiliaria,0,387,0%,52.89
design und architektur an der costa del sol,0,378,0%,30.75
agence immobilière en espagne,0,376,0%,57.74
new build apartments in costa del sol,0,364,0%,62.38
comprar vivienda a través de promotora inmobiliaria,0,361,0%,47.21
chalet calahonda,0,353,0%,26.71
villas for sale in el chaparral la cala,0,349,0%,29.11
commissiekosten,0,347,0%,6.86
multipropiedad mijas,0,342,0%,44.51
costa del sol ville,0,340,0%,12.24
pisos en la costa del sol,0,340,0%,54.44
placas solares torrox,0,336,0%,47.63
casa de lusso a marbella,0,333,0%,10.26
construction fuengirola,0,329,0%,65.64
quien paga la comisión de la inmobiliaria,0,328,0%,50.16
agence immobiliere espagne,0,325,0%,62.27
quien paga la comision de la agencia inmobiliaria,0,324,0%,30.19
inmobiliarias de lujo en ojen,0,323,0%,9.75
inmobiliarias de lujo en mijas,0,323,0%,10.27
property for sale palo alto marbella,0,321,0%,34.79
appartement kopen mijas costa,0,318,0%,15.96
agence immobilière andalousie,0,314,0%,32.3
agence immobiliere costa del sol,0,309,0%,38.8
comprar villa marbella,0,303,0%,78.07
apartamentos obra nueva en la costa del sol,0,302,0%,36.14
villa manilva,0,302,0%,40.15
construction nueva andalucia,0,297,0%,23.83
new build apartments costa del sol,0,294,0%,60.53
appartements vendre fuengirola,0,290,0%,35.46
new developments fuengirola,0,286,0%,14.47
alquiler vacacional mijas,0,285,0%,47.3
promociones de obra nueva costa del sol,0,281,0%,36.46
property for sale in el chaparral la cala,0,279,0%,59.12
casas de lujo en mijas,0,272,0%,7.73
apartamentos a la venta el higueron,0,271,0%,43.44
porque contratar una inmobiliaria,0,271,0%,81.5
pisos con vistas al mar,0,270,0%,16.05
villas in fuengirola,0,269,0%,13.26
penthouses for sale in estepona,0,269,0%,48.66
immobili di lusso in vendita a marbella e sulla costa del sol,0,267,0%,17.18
villa cabopino,0,267,0%,50.71
immobili di lusso sulla costa del sol,0,266,0%,11.63
proprietà di lusso in vendita sulla costa del sol,0,266,0%,21.09
appartement kopen spanje costa del sol,0,266,0%,38.13
propiedades de lujo en venta en mijas y alrededores,0,264,0%,18.95
chalets fuengirola,0,264,0%,24.73
spain construction materials prices news,0,261,0%,8.53
villas calahonda,0,260,0%,91
nieuwbouw appartementen fuengirola,0,253,0%,13.94
immobilier fuengirola,0,249,0%,38.96
apartments for sale in fuengirola malaga,0,249,0%,60.93
quien paga comision inmobiliaria venta,0,248,0%,44.54
quien paga a la inmobiliaria el comprador o el vendedor,0,247,0%,30.34
property for sale fuengirola costa del sol,0,246,0%,41.08
pisos en mijas costa,0,246,0%,45.65
appartement estepona costa del sol,0,245,0%,60.79
bathrooms costa del sol,0,244,0%,58.23
marbella m2 luxury apartments,0,241,0%,42.52
quién paga la inmobiliaria el comprador o el vendedor,0,238,0%,26.42
piso en la costa del sol,0,238,0%,53.81
apartments calahonda mijas,0,238,0%,68.74
villa blanca,0,238,0%,77.58
quien paga la comision a la inmobiliaria,0,236,0%,52.03
propriétés de luxe sur la costa del sol,0,235,0%,56.71
aankoop vastgoed malaga costa del sol,0,235,0%,68.71
mijas costa appartement te koop,0,233,0%,14.66
appartement te koop mijas aan zee,0,213,0%,15.05
nieuwbouw appartement fuengirola,0,213,0%,43.35
agence immobilière marbella,0,212,0%,78.26
aticos lujosos,0,212,0%,83.58
constructora chalets,0,211,0%,79.61
el blog de blanca,0,210,0%,41.77
villas for sale fuengirola,0,209,0%,21.59
luxury real estate calahonda,0,208,0%,27.92
agencia de marketing inmobiliario en mijas,0,207,0%,48.12
aticos de lujo con piscina privada,0,207,0%,63.51
blog de blanca,0,206,0%,31.5
mijas costa del sol alquiler vacacional,0,206,0%,36.94
constructora fuengirola,0,206,0%,38.59
agence immobilière,0,206,0%,47.5
propiedades de obra nueva en mijas,0,204,0%,20.31
costa del sol appartementen,0,204,0%,22.83
chalet fuengirola,0,204,0%,28.05
placas solares en torrox,0,204,0%,57.81
apartment for sale fuengirola spain,0,203,0%,54.3
townhouse fuengirola,0,201,0%,52.34
calahonda beach apartments for sale,0,199,0%,35.01
comprare casa in spagna,0,197,0%,32.19
wohnung kaufen meerblick costa del sol,0,196,0%,14.38
inmobiliaria,0,193,0%,1.3
vender casa en fuengirola,0,193,0%,68
iva honorarios agencia inmobiliaria,0,192,0%,45.83
huis kopen calahonda,0,191,0%,18.19
apartments for sale in calahonda,0,191,0%,29.3
que es la comision inmobiliaria,0,188,0%,74.92
villas in la cala de mijas,0,187,0%,56.12
comprar villa en marbella,0,187,0%,79.28
quien paga a la inmobiliaria en una venta,0,186,0%,10.83
vacant property protection spain,0,186,0%,39.66
penthouse sea view estepona,0,186,0%,55.6
koopappartementen costa del sol,0,184,0%,10.3
césped natural villas costa del sol,0,184,0%,54.36
chalet costa del sol,0,183,0%,66.38
commission agence immobiliere espagne,0,182,0%,19.92
alquiler vacacional la cala de mijas,0,182,0%,68.88
comprare casa a marbella la mecca della costa del sol,0,181,0%,15.65
nieuwbouw appartementen te koop estepona,0,181,0%,20.01
nieuwbouw appartementen costa del sol,0,181,0%,26.3
new apartment in costa del sol,0,181,0%,69.47
penthouses for sale costa del sol,0,181,0%,70.62
alquiler vacacional en mijas costa,0,179,0%,37.58
impuestos compra de viviendas malaga,0,178,0%,16.76
calahonda apartments for sale,0,178,0%,33.56
agence immobiliere costa blanca,0,177,0%,48.15
comision inmobiliaria al comprador,0,177,0%,56.2
achat maison fuengirola,0,176,0%,15.44
piso con vistas al mar,0,176,0%,15.52
villa marbella venta,0,174,0%,66.19
new apartments for sale costa del sol,0,173,0%,43
construccion de chalets,0,173,0%,52.2
gastos inmobiliaria,0,173,0%,59.88
aankoop vastgoed costa del sol,0,173,0%,83.49
apartments for sale in fuengirola costa del sol,0,171,0%,30.36
landhaus kaufen meerblick marbella,0,171,0%,40.61
buy penthouse estepona,0,171,0%,45.94
fuengirola beach apartments for sale,0,168,0%,68.72
appartement mijas,0,167,0%,53.76
landhaus kaufen pool malaga,0,166,0%,42.31
goedkope appartementen te koop costa del sol,0,165,0%,18.07
penthouse fuengirola,0,164,0%,17.06
pisos en cancelada,0,163,0%,12.22
inversiones inmobiliarias calahonda,0,163,0%,33.99
pisos de lujo en marbella,0,161,0%,37.85
luxury real estate mijas,0,161,0%,53.93
agence immobilière francophone en espagne,0,161,0%,74.65
villas en venta en manilva,0,160,0%,39.98
plots for sale nueva andalucia,0,160,0%,46.14
luxury plot marbella,0,159,0%,19.74
luxury apartments fuengirola,0,159,0%,72.77
solpaneler torrox,0,158,0%,17.78
casa in spagna,0,158,0%,47.14
case a costa del sole,0,157,0%,24.23
luxusvillen costa del sol,0,157,0%,41.04
comprare casa a minorca tasse,0,155,0%,15.69
villa la cala de mijas,0,155,0%,42.18
appartement zeezicht costa del sol,0,154,0%,43.67
cuanto es la comision de un agente inmobiliario,0,154,0%,72.64
apartment higueron,0,153,0%,51.49
aticos con piscina privada,0,153,0%,76.25
appartement te koop mijas bankbeslag,0,152,0%,30.86
villa blanca fuengirola,0,151,0%,12.19
pisos costa del sol,0,151,0%,41.91
agenzia immobiliare italo-olandese,0,150,0%,22.04
agenti immobiliari italiani a marbella,0,150,0%,39.79
immobilier mijas,0,149,0%,48.05
chalet en venta en manilva,0,148,0%,20.26
comision agente inmobiliario,0,148,0%,31.66
alquiler apartamentos vacaciones mijas costa,0,147,0%,34.35
apartamentos vacaciones mijas costa,0,147,0%,37.6
el comprador tiene que pagar comisión a la inmobiliaria,0,146,0%,40.25
property to buy in fuengirola,0,146,0%,73.13
nieuwbouw appartementen estepona,0,145,0%,18.34
apartamentos para alquilar en mijas costa,0,145,0%,70.46
villas en manilva,0,144,0%,21.25
apartments for sale pool costa del sol,0,144,0%,23.67
mijas costa apartamentos de vacaciones,0,143,0%,40.91
finca kaufen meerblick costa del sol,0,143,0%,42.85
agence immobilière espagne costa brava,0,143,0%,71
rent villa ojen,0,143,0%,80.62
acheter un appartement en espagne fiscalité,0,143,0%,90.54
pisos en venta fuengirola,0,142,0%,22.02
compravendite e locazioni immobiliari in spagna,0,141,0%,33.05
vivienda en fuengirola,0,140,0%,12.06
agence immobiliere iles baleares,0,139,0%,48.12
inrealty fuengirola,0,139,0%,64.12
real estate on costa del sol,0,139,0%,65.32
penthouses for sale in fuengirola,0,139,0%,65.83
seaview penthouses in estepona,0,138,0%,16.07
appartement mijas kopen,0,137,0%,9.92
frais d'agence espagne,0,137,0%,26.53
aticos en las lagunas mijas costa,0,137,0%,33.12
immobilien kaufen meerblick costa del sol,0,137,0%,33.72
costa del sol appartamenti,0,136,0%,47.21
mijas apartamentos de vacaciones,0,136,0%,49.2
beach apartments for sale fuengirola,0,136,0%,50.43
agence immobilière de luxe,0,136,0%,61.92
agence immobiliere costa brava,0,136,0%,65.59
apartments buy pool costa del sol,0,135,0%,14.01
spanish estate agent fees,0,135,0%,19.88
location villa vacances blanca,0,135,0%,47.16
estepona nieuwbouw appartement,0,134,0%,15.99
alquiler casa vacaciones mijas costa,0,133,0%,42.14
new build costa del sol,0,133,0%,82.15
pisos en fuengirola en venta,0,132,0%,15.87
promociones obra nueva playa costa del sol,0,132,0%,26.11
venta de pisos en fuengirola,0,132,0%,32.62
mijas apartamento de vacaciones,0,132,0%,45.89
invertir en andalucía,0,132,0%,63.75
appartamenti a costa del sole,0,131,0%,49.84
mijas apartamentos vacaciones,0,131,0%,56.31
immobiliensteuer spanien,0,131,0%,80.76
real estate costa del sol,0,130,0%,41.28
property for sale el chaparral,0,129,0%,66.46
mijas alquiler vacacional,0,129,0%,71.02
pisos en venta en fuengirola,0,128,0%,29.57
villas with sea views in marbella,0,127,0%,84.57
exklusive immobilien costa del sol,0,126,0%,30.12
vente appartement fuengirola,0,126,0%,33.61
lujo costa del sol,0,125,0%,11.79
appartementen mijas te koop,0,125,0%,14.18
casas y pisos en venta fuengirola,0,125,0%,55.74
casas de lujo con vistas al mar,0,124,0%,78.16
appartement kopen mijas,0,123,0%,17.88
que comision cobra un agente inmobiliario,0,123,0%,69.16
spanish estate agents fees,0,122,0%,23.31
lusso ville sul mare,0,122,0%,24.64
hypothek spanien ausländer,0,122,0%,32.52
villas la cala de mijas,0,122,0%,61.44
darya estepona penthouse,0,122,0%,83.15
fuengirola casas,0,121,0%,36.9
te koop cancelada,0,121,0%,53.64
nuevas construcciones costa del sol,0,120,0%,39.18
penthouse met zwembad,0,119,0%,24.93
apartment for sale calahonda,0,119,0%,35.97
agent immobilier marbella,0,119,0%,68.27
huurvergunning andalusie,0,119,0%,81.92
chalet manilva,0,118,0%,15.14
agence immobiliere costa brava espagne,0,118,0%,80.2
agence immobiliere en espagne costa brava,0,118,0%,88.36
modernes haus spanien,0,117,0%,21
comercialización fincas calahonda,0,117,0%,25.62
costa del sol real homes,0,117,0%,37.68
proyecto de villa moderna en nueva andalucía,0,117,0%,39.19
luxury apartments for sale costa del sol,0,117,0%,45.69
agence immobiliere costa de la luz,0,117,0%,58.44
marbella appartamenti,0,117,0%,73.23
villa calahonda,0,116,0%,48.9
apartamentos en málaga para larga temporada,0,116,0%,69.63
frais d'agence en espagne,0,115,0%,23.39
apartments for sale in fuengirola,0,115,0%,23.52
casa real,0,115,0%,62.29
villas mijas,0,114,0%,29.06
achat appartement fuengirola,0,114,0%,30.96
häuser costa del sol,0,114,0%,43.51
immobilier malaga vue mer,0,114,0%,46.48
kaufen meerblick costa del sol,0,113,0%,32.96
appartement kopen in spanje costa del sol,0,113,0%,36.57
real estate agents calahonda,0,113,0%,48.03
parcelas en venta en marbella,0,112,0%,87.93
cocina urbano torrox costa telefono contacto,0,111,0%,8.27
villa en fuengirola,0,111,0%,9.64
vivienda en estepona,0,111,0%,14.69
new development forsale higueron,0,111,0%,63.56
certificado energetico a,0,111,0%,80.25
huis kopen cancelada,0,110,0%,59.08
comision inmobiliaria,0,110,0%,61.22
construccion vivienda lujo,0,110,0%,63.71
fiscalité espagne immobilier,0,110,0%,89.52
estepona nieuwbouw,0,109,0%,17.75
villas for sale in el chaparral,0,109,0%,43.05
villas en mijas,0,109,0%,48.89
agence immobiliere benalmadena,0,108,0%,57.92
builders fuengirola,0,108,0%,75.04
palo alto ojen marbella,0,107,0%,9.79
te koop huis malaga costa del sol,0,106,0%,20.78
wohnung kaufen pool costa del sol,0,106,0%,31.07
obra nueva en manilva,0,105,0%,17.43
proyecto villa real,0,105,0%,36.41
atico 2,0,104,0%,15.92
landhaus kaufen costa del sol,0,104,0%,30.83
wohnung kaufen am meer costa del sol,0,104,0%,37.51
buy plot in marbella,0,104,0%,53.22
asesoramiento inmobiliario en calahonda,0,103,0%,78.41
self sustained housing,0,103,0%,85.03
pisos en calahonda,0,102,0%,14.65
buy exclusive plot marbella,0,100,0%,38.42
new build properties in fuengirola,0,100,0%,44.63
achat appartement benahavis,0,100,0%,47.33
appartement mijas costa te koop,0,99,0%,16.25
appartementen in fuengirola,0,99,0%,57.4
new built villa costa costa del sol,0,99,0%,59.38
fuengirola appartamenti,0,98,0%,33.22
casas en venta en fuengirola,0,98,0%,34.14
huis kopen cancelada estepona,0,98,0%,37.4
deutscher immobilienmakler costa del sol,0,98,0%,69.93
villa te koop fuengirola,0,97,0%,51.06
nieuwbouwwoning costa del sol,0,97,0%,72.23
arquitectura casa moderna fuengirola,0,97,0%,73.76
appartement kopen calahonda,0,96,0%,14.92
luxury villa mijas,0,96,0%,55.17
property for sale rincón de la victoria,0,96,0%,77.86
te koop calahonda,0,95,0%,10.66
nieuwbouw projecten estepona,0,95,0%,20.42
luxury villas mijas,0,95,0%,66.67
descubre las ventajas de confiar en una promotora inmobiliaria,0,94,0%,18.85
finca kaufen pool costa del sol,0,94,0%,41.78
real estate in fuengirola,0,94,0%,57.57
comisión por venta,0,94,0%,64.44
chalet torreblanca,0,94,0%,85.72
villas de lujo en la costa del sol,0,93,0%,47.25
calahonda estate agents,0,93,0%,76.1
appartement kopen cancelada estepona,0,92,0%,32.17
appartement kopen fuengirola,0,92,0%,48.63
agence immobiliere moraira,0,92,0%,72.49
appartements de vacances sur la costa del sol,0,91,0%,17.68
torreblanca fuengirola,0,91,0%,24.24
venta de pisos en sotogrande vistas mar,0,91,0%,26.14
agent immobilier francophone à málaga,0,91,0%,33.3
comprare casa in spagna a poco prezzo,0,91,0%,36.03
apartamentos de alquiler en mijas costa,0,91,0%,69.16
quien paga los gastos de inmobiliaria en una venta,0,90,0%,11.02
touristische vermietung andalusien,0,90,0%,24
villas en mijas costa,0,90,0%,53.7
agence immobiliere andalousie,0,89,0%,24.65
landhaus kaufen meerblick malaga,0,89,0%,34.83
appartement spanje kopen costa del sol,0,89,0%,45.66
new developments in estepona,0,89,0%,67.71
real estate spain costa del sol,0,89,0%,70.34
large villas in mijas costa,0,89,0%,88.29
landhaus kaufen am meer marbella,0,88,0%,48.42
vender mi casa en fuengirola,0,88,0%,67.83
traumvilla costa del sol,0,87,0%,19.06
case in vendita in marbella,0,86,0%,28.88
property for sale eastern costa del sol,0,86,0%,32.63
new developments costa del sol,0,86,0%,55.76
buy superprime plot marbella,0,86,0%,72.2
alquiler vacacional en mijas,0,85,0%,51.12
terrazas de miraflores,0,84,0%,4.07
quanto costa una casa in spagna,0,84,0%,10.89
nieuwbouw calahonda,0,84,0%,16.95
la nueva benalmadena,0,84,0%,21.43
vender propiedad en calahonda,0,84,0%,23.38
wohnung kaufen costa del sol,0,84,0%,39.98
servicio de arquitectura en manilva,0,84,0%,52.12
apartments buy pool estepona,0,84,0%,60.52
pisos en venta en ojen,0,83,0%,23.81
nieuwbouwwoning fuengirola,0,83,0%,28.37
buy luxury plot marbella,0,83,0%,36.34
venta pisos lujo marbella,0,83,0%,47.82
new build apartments estepona,0,83,0%,49.96
venta de obra nueva,0,83,0%,55.83
finca kaufen am meer costa del sol,0,83,0%,56.41
villa cabopino marbella,0,83,0%,64.16
alquiler vacacional calahonda mijas,0,83,0%,71.24
property in rincón de la victoria,0,83,0%,76.78
centro benessere fuengirola,0,83,0%,85.76
inmobiliaria y construccion en fuengirola,0,82,0%,26.99
construcciones chalets,0,82,0%,32.6
wohnung kaufen meerblick marbella,0,82,0%,34.63
cancelada te koop,0,82,0%,34.79
apartments to buy in costa del sol,0,82,0%,39.39
villa kopen cancelada estepona,0,82,0%,58.45
appartement te koop in costa del sol,0,81,0%,8.72
how much do real estate agents make per sale,0,81,0%,10.72
agentes inmobiliarios comisiones,0,80,0%,16.19
luxury penthouses for sale estepona,0,80,0%,30.26
appartement malaga,0,80,0%,32.85
luxury houses in mijas,0,80,0%,38.77
agence immobilière blanes,0,80,0%,48.01
obra nueva malaga costa,0,80,0%,58.33
casas certificación energética a+,0,80,0%,65.64
cocina urbano torrox costa telefono,0,79,0%,10.34
chalets en fuengirola,0,79,0%,31.7
luksus villa malaga,0,79,0%,41.04
immobilier bord de mer espagne,0,79,0%,78.48
new developments in fuengirola,0,78,0%,9.71
appartementen mijas costa,0,78,0%,23.01
finca kaufen costa del sol,0,78,0%,34.53
landhaus kaufen pool marbella,0,78,0%,42.35
itp malaga,0,78,0%,46.09
agence immobilière calella de palafrugell,0,78,0%,62.42
villa costa del sol,0,78,0%,76.45
construction materials prices spain news,0,77,0%,9.83
casa adosada málaga,0,77,0%,51
agence immobiliere fuengirola,0,77,0%,69.29
mijas playa apartamentos,0,77,0%,70.09
villas de lujo en nueva andalucia,0,77,0%,93.52
lujo marbella,0,76,0%,8.93
pisos real estate,0,76,0%,19.59
quien paga la inmobiliaria en una compraventa,0,76,0%,32.79
