Consultas principales,Clics,Impresiones,CTR,Posición
comprar apartamentos en fuengirola,0,76,0%,50.93
estepona new developments,0,76,0%,67.49
villas for sale pool costa del sol,0,76,0%,79.45
aticos de ensueño,0,76,0%,80.78
new production mijas costa,0,76,0%,82.55
nylva,0,75,0%,7.36
nuevos desarrollos en mijas,0,75,0%,34.48
agence immobiliere,0,75,0%,62.83
certificación energética vivienda nueva,0,75,0%,77.95
plot for sale in marbella,0,75,0%,82.44
apartamentos alquiler mijas,0,75,0%,82.61
costa brava agence immobiliere,0,75,0%,86.24
apartments for sale in calahonda spain,0,74,0%,34.96
appartement te koop málaga kust,0,74,0%,35.89
haus kaufen meerblick costa del sol,0,74,0%,49.5
minimalistische fassaden,0,74,0%,85.85
villas de lujo costa del sol,0,73,0%,38.78
finca kaufen meerblick malaga,0,73,0%,43.52
construcciones de obra nueva costa del sol,0,73,0%,53.85
luxury apartments costa del sol,0,73,0%,62.88
luxury villa costa del sol,0,73,0%,76.68
ojen houses for sale,0,73,0%,77.45
apartments in calahonda marbella,0,73,0%,82.6
spanische häuser stil,0,72,0%,8.71
inmobiliaria blanca,0,72,0%,18.1
property for sale fuengirola costa,0,72,0%,60.97
comision de inmobiliarias,0,72,0%,73.01
villas de obra nueva en fuengirola,0,71,0%,6.24
obra nueva en costa del sol,0,71,0%,33.72
comprar piso en fuengirola,0,71,0%,35.87
appartement fuengirola,0,71,0%,43.7
property to buy fuengirola,0,71,0%,50.65
cuando se paga la comision inmobiliaria por venta,0,71,0%,62.44
location vacances blanca,0,71,0%,69.01
il tipico cortile spagnolo,0,70,0%,3.87
obra nueva el higueron,0,70,0%,18.63
wohnung kaufen meerblick malaga,0,70,0%,28.51
obra nueva costa del sol,0,70,0%,49.24
buy penthouses in estepona,0,70,0%,55.49
mar villas,0,70,0%,68.49
costa blanca real estates,0,70,0%,68.61
ventajas de comprar casa a una promotora,0,70,0%,94
blanca city prhomes,0,69,0%,9.7
property buy pool estepona,0,69,0%,53.36
villas for sale the hills,0,69,0%,64.72
villas en oferta en fuengirola,0,68,0%,8.99
"pisos de la caixa, en fuengirola",0,68,0%,10.54
luxury apartments with sea views estepona,0,68,0%,17.16
immobilien kaufen pool costa del sol,0,68,0%,58.21
vacaciones mijas costa,0,68,0%,59.35
self sufficient home,0,68,0%,62.1
spain real estate malaga,0,68,0%,74.74
hausverkauf spanien steuern,0,68,0%,90.37
mijas ville,0,67,0%,32.64
propiedad frente al mar en venta en fuengirola,0,67,0%,46.91
costa del sol appartement a vendre,0,67,0%,47.91
villas nuevas en la costa del sol,0,67,0%,51.33
servicio de arquitectura en cancelada,0,67,0%,61.75
kosten hauskauf spanien,0,67,0%,76.52
villa sale costa del sol,0,67,0%,81.52
immobilier en espagne bord de mer,0,67,0%,93.13
nieuwbouwprojecten fuengirola,0,66,0%,28.48
propiedad en venta en mijas costa,0,66,0%,41.09
villas en oferta en mijas costa,0,66,0%,41.64
landhaus kaufen am meer malaga,0,66,0%,48.7
benalmadena real estate,0,66,0%,88.73
villas en venta costa del sol,0,66,0%,93.35
who pays agency fees in spain,0,65,0%,9.02
immobili in vendita costa del sol,0,64,0%,18.97
nuevas casas en mijas,0,64,0%,29.44
agence immobiliere torre del mar,0,64,0%,35.2
propiedad en calahonda para comprar,0,64,0%,42.42
villas en venta en calahonda espana,0,64,0%,43.45
expertise immobilière espagne,0,64,0%,52.67
propiedad en venta en calahonda,0,64,0%,55.48
propiedad en venta en fuengirola,0,64,0%,63.59
costa del sol zeezicht,0,64,0%,69.14
honorarios agencia inmobiliaria,0,64,0%,76.77
real estate in costa del sol,0,64,0%,77.88
urbano torrox costa,0,63,0%,10.81
comision inmobiliaria venta,0,63,0%,28.7
appartementen te koop spanje fuengirola,0,63,0%,32.68
comision por venta de inmuebles whatsapp,0,63,0%,41.02
comprar propiedad fuengirola,0,63,0%,50.57
apartments in calahonda,0,63,0%,61.75
plano villa,0,62,0%,3.74
real estate agents commissions,0,62,0%,9.16
appartement te koop mijas,0,62,0%,10.45
wohnungen fuengirola,0,62,0%,33.19
pisos en benalmádena,0,62,0%,34.82
landhaus kaufen meerblick costa del sol,0,62,0%,35.52
agence immobiliere tamariu,0,62,0%,41.58
vistas desde arriba marbella,0,62,0%,43.16
real estate fuengirola spain,0,62,0%,46.76
huis costa del sol kopen,0,61,0%,13.66
villas con vistas al mar,0,61,0%,38.67
alquiler apartamento en mijas costa,0,61,0%,51.43
landhaus kaufen am meer costa del sol,0,61,0%,62.67
spain building materials prices news,0,60,0%,9.05
new production fuengirola,0,60,0%,19.05
villas en oferta en calahonda,0,60,0%,29.63
obra nueva la cala de mijas,0,60,0%,38.38
huis kopen mijas costa,0,60,0%,44.38
costa del sol luxury apartments for sale,0,60,0%,44.9
appartement calahonda,0,60,0%,57.27
immobilier malaga costa del sol,0,60,0%,66.67
apartments sea views costa del sol,0,60,0%,67.08
house for sale in fuengirola spain,0,60,0%,79.33
luxury real estate costa del sol,0,60,0%,80.3
viviendas de lujo costa del sol,0,60,0%,97.7
cocina de urbano torrox costa,0,59,0%,9.97
cancelada,0,59,0%,25.25
quartiers benahavis,0,59,0%,32.92
comprare casa spagna,0,59,0%,34.8
zeezicht costa del sol,0,59,0%,47.03
propiedad en venta en mijas costa del sol,0,59,0%,47.42
quien tiene que pagar los honorarios de la inmobiliaria,0,59,0%,55.41
nachhaltige häuser an der costa del sol,0,59,0%,55.97
wohnung kaufen günstig costa del sol,0,59,0%,62.42
construcción vivienda de lujo,0,59,0%,75.8
cuanto cuesta un local de 100m2,0,58,0%,10.43
property for sale in spain costa del sol fuengirola,0,58,0%,30.05
landhaus kaufen pool costa del sol,0,58,0%,34.79
alquiler de apartamentos en mijas costa,0,58,0%,42.02
construcciones de chalets,0,58,0%,65.38
buy property in fuengirola,0,58,0%,70.67
certificado eficiencia energetica obra nueva,0,58,0%,77.31
huis kopen spanje fuengirola,0,57,0%,30.47
costa del sol immobiliare,0,57,0%,37.33
villas en venta,0,57,0%,41.46
vender mi villa en calahonda,0,57,0%,42.56
alya mijas,0,57,0%,51.09
finca kaufen meerblick marbella,0,57,0%,52.63
nieuwbouw mijas costa,0,57,0%,64.42
villas in mijas costa,0,57,0%,68.56
plots for sale marbella,0,57,0%,69.46
new development fuengirola,0,56,0%,16.93
arquitectura minimalista andaluza,0,56,0%,34.79
villa de luxe malaga,0,56,0%,45.77
buy apartment calahonda,0,56,0%,47.73
villa blanco,0,56,0%,83.82
stamp duty in spain,0,56,0%,86.14
villas buy pool costa del sol,0,56,0%,89.45
viviendas de obra nueva cancelada,0,55,0%,13.49
penthouses estepona,0,55,0%,24.15
appartamenti costa del sol,0,55,0%,34.6
property taxes estepona,0,55,0%,48.36
haus in marbella renovieren,0,55,0%,48.78
apartments for sale pool estepona,0,55,0%,51.02
3 bed apartment costa del sol,0,55,0%,60.6
agence immobiliere calella,0,55,0%,74.84
agence immobiliere velez malaga,0,55,0%,82.24
woning kopen fuengirola,0,54,0%,19.91
appartement kopen in fuengirola,0,54,0%,52
calahonda spain property for sale,0,54,0%,64.74
impot plus value immobiliere espagne,0,54,0%,86.48
apartments fuengirola costa del sol,0,54,0%,89.17
expo 2027 malaga,0,53,0%,10.68
resimo,0,53,0%,14.66
comision venta inmobiliaria,0,53,0%,30.38
apartamentos en venta en calahonda park,0,53,0%,30.55
agence immobiliere francaise espagne,0,53,0%,40.79
wohnung kaufen am meer malaga,0,53,0%,58.49
eva valero,0,53,0%,60.91
espagne immobilier bord de mer,0,53,0%,76.13
cocina del sol calahonda,0,52,0%,11.63
villas de lujo con vistas al mar,0,52,0%,27.48
maison malaga,0,52,0%,30.17
property for sale costa del sol sea view,0,52,0%,36.79
property for sale calahonda costa del sol,0,52,0%,40.96
duurzame woningen aan de costa del sol,0,52,0%,42.13
vastgoed te koop costa del sol,0,52,0%,51.52
appartement te koop málaga,0,52,0%,58.13
apartamento en mijas costa playa,0,52,0%,61.87
property for sale in calahonda costa del sol,0,52,0%,67.31
penthouses for sale guadalobon,0,52,0%,73.42
flats for sale in fuengirola spain,0,52,0%,73.48
commissie makelaar spanje,0,51,0%,7.29
apartments for sale costa del sol,0,51,0%,15.96
calahonda collection,0,51,0%,17.06
cancelada estepona,0,51,0%,18.63
ville di lusso in vendita marbella,0,51,0%,40.14
promoción inmobiliaria de lujo en torremolinos,0,51,0%,48.69
koop appartement fuengirola,0,51,0%,50.33
placas solares manilva,0,51,0%,63.73
luxe appartement fuengirola,0,51,0%,69.71
nieuwbouw villa estepona,0,51,0%,74.1
construcción villa de lujo costa del sol,0,51,0%,84.16
ojen apartments for sale,0,51,0%,92.24
villa rincon de la victoria,0,51,0%,92.25
local de 100m2,0,50,0%,4.86
torreblanca villa,0,50,0%,4.94
comisión agencia inmobiliaria,0,50,0%,19.06
plan villas,0,50,0%,23.92
flats for sale pool costa del sol,0,50,0%,30.88
estepona centro,0,50,0%,33.1
appartements fuengirola,0,50,0%,43.16
new developments in calahonda,0,50,0%,48.06
building plot marbella,0,50,0%,48.78
apartamentos en venta en el club de golf de mijas,0,50,0%,48.88
piso en torreblanca fuengirola,0,50,0%,56.94
kaufen am meer costa del sol,0,50,0%,63.16
real estate agent manilva,0,50,0%,68.48
ocean view ojén,0,50,0%,78.2
"""nueva fuengirola""",0,49,0%,6.47
nueva construcción,0,49,0%,7.94
dormitorios fuengirola,0,49,0%,22.14
huis te koop spanje fuengirola,0,49,0%,35.06
ville di lusso sul mare,0,49,0%,36.16
apartamentos en mijas costa vacaciones,0,49,0%,36.18
buy land to build villa marbella,0,49,0%,36.92
maison moderne espagne,0,49,0%,47.49
property calahonda spain,0,49,0%,63.76
haus kaufen am meer malaga,0,49,0%,73.18
acheter villa costa del sol,0,49,0%,74.43
apartamentos costa del sol venta,0,49,0%,83.24
andalusian tourism registry,0,48,0%,8.62
iva comision inmobiliaria,0,48,0%,8.69
la condesa fuengirola,0,48,0%,10.44
villas exclusivas,0,48,0%,21.44
appartement te koop in malaga aan zee,0,48,0%,22.35
agency fees in spain,0,48,0%,35.96
locales comerciales para invertir en calahonda,0,48,0%,39.44
costa del sol apartments to buy,0,48,0%,42.73
construccion chalets,0,48,0%,55.77
chasseur immobilier espagne,0,48,0%,59.98
townhouses for sale in fuengirola,0,48,0%,66.1
new developments mijas,0,48,0%,66.58
villas en venta en calahonda,0,48,0%,81.5
solar panels torrox,0,47,0%,30.23
deposito in conto vendita spagna,0,47,0%,40.6
calahonda del sol apartments,0,47,0%,41
houses buy pool estepona,0,47,0%,58.91
appartamenti a marbella,0,47,0%,61.87
villa forsale higueron,0,47,0%,68.21
agence immobilière benalmadena,0,47,0%,71.17
espagne immobilier costa brava,0,47,0%,82.32
property for sale monte paraiso,0,47,0%,85.77
expo malaga 2027,0,46,0%,9.22
ventanilla unica spagna affitti,0,46,0%,9.91
appartement kopen aan de costa del sol,0,46,0%,11.59
proyecto reforma local comercial en mijas,0,46,0%,32.02
aticos en estepona,0,46,0%,34.13
beach apartments for sale costa del sol,0,46,0%,36.91
quien paga la comision de la inmobiliaria en una venta,0,46,0%,41.17
property for sale in eastern costa del sol,0,46,0%,42.78
haus kaufen meerblick malaga,0,46,0%,54.96
apartments with sea views in marbella,0,46,0%,55.98
honorarios inmobiliaria por venta,0,46,0%,60.52
luxury mijas villas,0,46,0%,71.33
real estate agents mijas,0,46,0%,85.15
penthouses for sale in calahonda,0,46,0%,86.87
agence immobilière lloret de mar,0,46,0%,88.43
construccion villas,0,45,0%,29.91
property in calahonda spain,0,45,0%,65.02
comisión inmobiliaria,0,45,0%,66.53
comision por venta,0,45,0%,78.44
nuevas construcciones cancelada,0,44,0%,13.66
beachfront villas costa del sol,0,44,0%,17.2
fuengirola luxury apartments,0,44,0%,19
luxusvillen,0,44,0%,33.34
appartement te koop costa del sol bankbeslag,0,44,0%,37.25
haus kaufen pool costa del sol,0,44,0%,41.8
for sale higuerón,0,44,0%,44.2
ville in spagna,0,44,0%,44.91
quien paga los honorarios de la inmobiliaria,0,44,0%,46.05
marbella plot for sale sea view,0,44,0%,65.52
mijas villas for rent,0,44,0%,66.09
appartamenti marbella,0,44,0%,67.86
villas to rent in malaga costa del sol,0,44,0%,68.27
costa del sol chalet,0,44,0%,75.36
propiedad en venta en mijas golf resort,0,44,0%,79.27
agence immobiliere estepona,0,44,0%,81.73
quartiers apartments marbella,0,44,0%,85.84
agence immo espagne,0,44,0%,87.3
private villas in mijas costa,0,44,0%,99.02
comprare casa a barcellona tasse,0,43,0%,6.21
benalmadena obra nueva,0,43,0%,9
nieuwbouw appartementen te koop costa del sol,0,43,0%,13.72
agenzia immobiliare spagna,0,43,0%,23.98
properties fuengirola,0,43,0%,24.12
flats buy pool costa del sol,0,43,0%,26.42
agenzie immobiliari spagna,0,43,0%,27.72
costa del sol nieuwbouw,0,43,0%,34.14
pisos fuengirola,0,43,0%,37.79
finca kaufen pool malaga,0,43,0%,43.95
render local comercial,0,43,0%,47.14
apartments in fuengirola centre,0,43,0%,49.26
comisiones inmobiliarias,0,43,0%,63.28
en que momento se paga la comision inmobiliaria,0,43,0%,81.21
la terraza miraflores,0,42,0%,6.36
obras nuevas en venta cancelada,0,42,0%,6.5
viviendas en fuengirola,0,42,0%,14.26
villa in fuengirola,0,42,0%,29.19
off plan property costa del sol,0,42,0%,42.71
fuengirola spain real estate for sale,0,42,0%,51.55
apartamento en mijas playa,0,42,0%,58.55
villas in la cala costa del sol,0,42,0%,84.26
villas en calahonda,0,42,0%,87.29
costa del sol real estate agents,0,42,0%,89.19
how much do estate agents charge in spain,0,41,0%,8.59
ville di lusso costa del sol,0,41,0%,9.32
la cocina de urbano torrox costa,0,41,0%,11.56
appartement a vendre a fuengirola espagne,0,41,0%,21.49
constructora benalmadena,0,41,0%,32.27
quartiers benahavis marbella,0,41,0%,33.02
nuevas construcciones en la costa del sol,0,41,0%,52.22
construcción piscinas manilva,0,41,0%,53.63
plot marbella,0,41,0%,62.2
real estate agent costa del sol,0,41,0%,65.37
comprare casa alle canarie tasse,0,41,0%,75.98
agencia de marketing inmobiliario en puerto real,0,41,0%,76.66
immobilien an der costa del sol,0,41,0%,77.32
developments costa del sol,0,41,0%,86.63
immobilienmakler costa del sol deutsch,0,41,0%,86.73
apartamentos en oferta en mijas costa,0,41,0%,87.12
new build developments costa del sol,0,41,0%,88.59
cuando se pagan los honorarios a la inmobiliaria,0,40,0%,8.7
proprietà di lusso costa del sol,0,40,0%,12.43
venta de pisos en la costa del sol,0,40,0%,12.97
real estate commission,0,40,0%,27.07
piso venta fuengirola,0,40,0%,30.02
locales comerciales con terraza,0,40,0%,30.18
acquistare casa in spagna,0,40,0%,30.38
apartments for sale in cabopino,0,40,0%,44.4
spanisch immobilienmarkt,0,40,0%,59.83
agence immobilière platja d'aro,0,40,0%,65.05
aticos lujo,0,40,0%,67.15
bungalow fuengirola,0,40,0%,67.67
new development costa del sol,0,40,0%,79.95
agence immobiliere marbella,0,40,0%,86.25
villa blaca,0,40,0%,90.9
vender mi casa en mijas,0,40,0%,97.08
urbanizacion torreblanca fuengirola,0,39,0%,9.33
piso en venta fuengirola,0,39,0%,17.97
quien paga los gastos de la inmobiliaria,0,39,0%,22.51
comision de agencia inmobiliaria,0,39,0%,27.97
adosados de lujo,0,39,0%,41.51
property in fuengirola for sale,0,39,0%,49.08
fuengirola pisos,0,39,0%,49.85
luxury villa in costa del sol,0,39,0%,69.31
plus value immobilière espagne,0,39,0%,78.95
inmobiliaria de lujo en marbella,0,39,0%,90.51
rental villas ojen,0,39,0%,93.46
quien paga la comisión de la inmobiliaria en una venta,0,38,0%,1.55
pisos frente al mar,0,38,0%,9.76
nuevas promociones cancelada,0,38,0%,12.13
real estate brokerage commissions,0,38,0%,12.26
appartement costa del sol te koop,0,38,0%,12.89
quien paga los gastos de inmobiliaria en una compraventa,0,38,0%,25.97
urbanizacion mijas golf,0,38,0%,32.61
buy pool estepona,0,38,0%,54.92
estate agents in calahonda,0,38,0%,58.18
aerotermia en manilva,0,38,0%,62.39
mijas villas to rent,0,38,0%,67.92
flats in fuengirola,0,38,0%,70.16
immobili in spagna,0,38,0%,76.95
beachfront property costa del sol,0,38,0%,77
alquiler apartamentos vacaciones la cala de mijas,0,38,0%,83.24
plus value en espagne,0,38,0%,84.03
impot plus value espagne,0,38,0%,85.03
propiedad en venta en la costa del sol,0,38,0%,85.79
la cala de mijas apartamentos de vacaciones,0,38,0%,86.37
plus value espagne,0,38,0%,87.79
cuanto son los honorarios de una inmobiliaria,0,37,0%,3.62
cocina de urbano torrox,0,37,0%,10.95
pisos de la caixa en fuengirola,0,37,0%,11.86
appartement kopen aan costa del sol,0,37,0%,12.49
qui paie les frais de notaire en espagne,0,37,0%,31.49
cuando se paga la comisión inmobiliaria por venta,0,37,0%,32.46
villa kaufen estepona,0,37,0%,36.03
appartement te koop fuengirola,0,37,0%,45.89
appartement marbella zeezicht te koop,0,37,0%,46.32
rent a villa in costa del sol,0,37,0%,75.65
comisión agente inmobiliario,0,36,0%,15.94
pisos nuevos en la costa,0,36,0%,16.03
pisos en venta cancelada,0,36,0%,25.28
apartments for sale calahonda costa del sol,0,36,0%,26.39
immobilien calahonda,0,36,0%,29.53
pisos rincon de la victoria,0,36,0%,48.36
landhaus kaufen meerblick spanien,0,36,0%,49.92
how much real estate agents make,0,36,0%,51.14
property in fuengirola spain,0,36,0%,58.22
viviendas en alquiler en mijas,0,36,0%,59.36
villen costa del sol,0,36,0%,61.64
calahonda property,0,36,0%,70
agence immobiliere majorque,0,36,0%,70.06
bargain villas calahonda,0,36,0%,78.19
agence immobiliere platja d aro,0,36,0%,85.14
4 bed penthouse apartment,0,35,0%,17.71
chalet en fuengirola,0,35,0%,21.49
penthouses mijas,0,35,0%,23
torreblanca fuengirola malaga,0,35,0%,37.03
estepona penthouse huren,0,35,0%,46.14
villas en venta en mijas,0,35,0%,48.17
gastos de una inmobiliaria,0,35,0%,53.37
appartement benahavis,0,35,0%,76.91
marketing agency costa del sol,0,35,0%,83.94
mijas appartement te koop,0,34,0%,9.88
gastos inmobiliaria quien paga,0,34,0%,18.62
häuser malaga,0,34,0%,21.35
spagna ville,0,34,0%,25.79
venta pisos fuengirola,0,34,0%,30
appartement te koop spanje costa del sol,0,34,0%,33.76
solarplatten torrox,0,34,0%,36.24
wohnungen costa del sol,0,34,0%,40.21
ocean view penthouses for sale,0,34,0%,41.41